{
  "$schema":"https://json-schema.org/draft/2020-12/schema",
  "$id":"https://a-lang.invalid/schemas/compact-projection-fidelity/phase-02/surface-registry-v1.schema.json",
  "type":"object",
  "additionalProperties":false,
  "required":["format","canonical_input","max_representation_bytes","surfaces","unknown_surface","unknown_version","unregistered_flags"],
  "properties":{
    "format":{"const":"alang-compact-surface-registry-v1"},
    "canonical_input":{"const":"checked-alang-task-comprehension-v1"},
    "max_representation_bytes":{"const":32768},
    "surfaces":{"type":"array","minItems":6,"maxItems":6,"items":{"type":"object","additionalProperties":false,"required":["id","representation","version","role","promotable","implementation_section"],"properties":{"id":{"enum":["R0","R1","R2","R3","R4","R5"]},"representation":{"type":"string","minLength":1},"version":{"type":"string","minLength":1},"role":{"type":"string","minLength":1},"promotable":{"type":"boolean"},"implementation_section":{"enum":["2.1","2.2","2.3"]}}}},
    "unknown_surface":{"const":"reject"},
    "unknown_version":{"const":"reject"},
    "unregistered_flags":{"const":"reject"}
  }
}
